{
  "project": {
    "name": "1 Greatmeadow",
    "slug": "8_greatmeadow",
    "description": "1 Greatmeadow - placeholder; run dxf_converter.py to populate from DXF"
  },
  "floors": [
    {
      "name": "basement",
      "floor_z": -8.17,
      "wall_top_z": 0.0,
      "zones": []
    }
  ],
  "perimeter": {
    "outer_polygon": {
      "vertices": [
        [0.0, 0.0],
        [50.0, 0.0],
        [50.0, 30.0],
        [0.0, 30.0]
      ],
      "segment_thickness": [0.833, 0.833, 0.833, 0.833],
      "note": "PLACEHOLDER: run dxf_converter.py to populate from 1_Greatmeadow_MEASURE.dxf"
    }
  },
  "interior_partitions": [],
  "diagonals": [],
  "openings": [],
  "structure": {
    "beams": [],
    "posts": [],
    "footings": [],
    "stairs": [],
    "areaways": []
  }
}
